Feature_Name,,, Feature_Definition
Obligatory Double Negation in SVO languages,,, Nothing found on this topic!
Multiple Negative Constructions in SVO Languages,,, Nothing found on this topic!
The Position of Negative Morphemes in SVO Languages,,, Nothing found on this topic!
Verb-Initial with Negative that is Immediately Postverbal or between Subject and Object,,, Nothing found on this topic!
Optional Double Negation in SOV languages,,, Nothing found on this topic!
SNegOV Order,,, Nothing found on this topic!
The Position of Negative Morphemes in SOV Languages,,, Nothing found on this topic!
NegSVO Order,,, Nothing found on this topic!
Languages with different word order in negative clauses,,, Nothing found on this topic!
The Position of Negative Morphemes in Verb-Initial Languages,,, Nothing found on this topic!
Order of Object, Oblique, and Verb,,, This map shows the dominant order of lexical object, oblique phrase and verb. An oblique phrase is a noun phrase or adpositional phrase (prepositional or postpositional) that functions as an adverbial modifier (or “adjunct”) of the verb. Of the six logically possible orders, five are attested, as illustrated in (1), where X  stands for an oblique phrase.
The Velar Nasal,,, This chapter addresses the distribution of the sound ŋ (the velar nasal) in the languages of the world. A very large number of languages make use of phonemic ŋ, while many others lack this sound. However, few of the sounds commonly found among the phonemic inventories of the world's languages exhibit a more clearly definable distribution than that exhibited by ŋ. This distribution has two unrelated aspects. One is the striking areal distribution of the presence vs. absence of phonemic ŋ among the languages of the world. The other striking aspect of phonemic ŋ is its phonotactic distribution: in many languages possessing this sound, it may not appear in all positions in the word, but rather is restricted to initial, medial, or final position, or some combination thereof. In the case of restriction of ŋ to non-initial position, this, too, has a relatively pronounced areal skewing among the world’s languages.
Zero Copula for Predicate Nominals,,, This map shows the areal distribution of zero copula encoding for predicate nominals. That is, the map indicates whether a given language is like English, in which predicate nominals always require an overt copula (see 1), or rather like Russian, in which omission of the copula is allowed for at least some constructions (see 2).
Order of Adjective and Noun,,, This map shows the distribution of the two possible orders of modifying adjective and noun.  English is an example of a language which is AdjN, with the adjective preceding the noun (as in large dogs ). Another example is Mising (Tibeto-Burman; northeast India), as in (1).
Relationship between the Order of Object and Verb and the Order of Adposition and Noun Phrase,,, One of the central activities in linguistic typology is the investigation of relationship between different typological features. Maps 95A, 96A, and 97A illustrate three sorts of relationship between typological features. If one takes two typological features with two values each, they intersect to define four possible language types. This map, Map 95A, illustrates a case where two of these types are very common and two are relatively uncommon. Map 96A illustrates a case where three of these types are very common and one is relatively uncommon. And Map 97A illustrates a case where there is no interaction between the two features, where all four types are very common. Each of these three maps shows the relationship between two features that are shown separately on other maps in this atlas.
Inflectional Synthesis of the Verb,,, Grammatical categories like tense, voice, or agreement can be expressed either by individual words or by affixes attached to some other word (or the stem of a word). If a word combines with affixes, the resulting construction is said to be synthetic; if not, it is said to be analytic. For example, in the past tense, the English verb combines with an affix expressing tense (cf. she painted, with suffix -ed ). Forms like painted  are called synthetic. In the future tense, by contrast, the verb does not combine with an affix; the future is instead expressed by a separate word (will, as in she will paint ). Expressions like will paint  are called analytic.
Rhythm Types,,, Assuming that the phonemes that make up words are organized into syllables, modern linguistic theory claims that rhythm is a manifestation of the fact that syllables are further grouped into constituents called feet, which are usually binary groupings of syllables. Standard Metrical Theory takes the grouping of syllables into feet as fundamental for the assignment of bounded primary stress. StressTyp is based on a separation of the treatment of primary and secondary stress. Such a separation has been proposed and defended on theoretical grounds by van der Hulst (1996). We offer several arguments here.
Applicative Constructions,,, In an applicative construction, the number of object arguments selected by the predicate is increased by one with respect to the basic construction. For example, in Tukang Besi (Austronesian; Sulawesi, Indonesia), the verb ‘fetch’ takes one theme object in the basic construction (as shown in 1a), but with the applicative marker it takes two objects, theme and benefactive (as shown in 1b).
Other Roles of Applied Objects,,, It is sometimes hard to tell from grammatical descriptions whether benefactive is differentiated from recipient/goal, or other common roles associated with the applied object. It is also unclear how many languages merge benefactive and malefactive (the adversely affected object); impressionistically it seems more typical to keep them apart. In addition, the applied object can be mapped onto a possessor, whose place in the hierarchy of semantic roles is not quite clear. Benefactives, goals, and possessors are typically animate participants, which may create an impression that the applied object has to be an animate participant. Indeed, in some languages (e.g., Halkomelem) the referent of the applied object must be animate regardless of its semantic role (Gerdts 1988a; Gerdts 1993.) In some languages, e.g. Kinyarwanda, the linear order of the base and applied object varies depending on animacy (Kimenyi 1988; Polinsky and Kozinsky 1992; Polinsky 1995). Overall, animacy probably constitutes a separate dimension in the semantics of the applied object.
The Past Tense,,, In (1) the form of the finite verb (in this case, the copula is/was) depends on what time we are talking about – what we may call the topic time (following Klein (1994)): the present form is  is used if the topic time coincides with the time of speech, and the past form was  if the topic time precedes the time of speech. This is of course a very rough rule in need of a number of further specifications. As was already noted in the introductory chapter, grammaticalized marking of time in the form of tenses is typically independent of considerations of relevance. The fact that time in (1) is also indicated (and more precisely so) by time adverbials does not make tense marking less necessary. Rather, the presence of a deictic time adverbial such as yesterday  renders the use of anything but the simple past tense unacceptable in (1b).
Consonant Inventories,,, This chapter and the next few chapters will look at various aspects of the complexity of the sound resources used in the world’s languages and examine how this complexity is distributed geographically. The first aspect to be examined is the size of the set of consonants used in the language, usually referred to as the consonant inventory. This is one element of what is called the phonology of the language.
Weight Factors in Weight-Sensitive Stress Systems,,, Diacritic weight equals lexical marking. Rhythmic weight was assumed for count systems (cf. Chapter 15, §2.2). The first-mentioned category, intrinsic weight, needs some further comment. The intrinsic properties that determine weight can differ from one language to the next. An important determinant of weight is vowel length, closely followed by syllable closure. In principle, the two factors are independent, but often both long vowels and closing consonants will cause syllables to be heavy for primary and/or secondary stress in one and the same language, leaving the light category for open, short-voweled syllables. Vowel length and syllable closure are sometimes referred to as quantitative weight.
Nominal and Verbal Conjunction,,, In the European languages, the same marker is used both for conjunction of noun phrases and for conjunction of verb phrases and clauses, as illustrated in (1) for Hungarian (and for English in the translation). Thus, Hungarian és  and English and  can conjoin both nominal and verbal/clausal constituents.
Subtypes of Asymmetric Standard Negation,,, The term standard negation refers to the basic way(s) a language has for negating declarative verbal main clauses. In symmetric negation affirmative and negative structures are identical except for the presence of the negative marker(s), whereas in asymmetric negation the structure of negatives differs from the structure of affirmatives in various other ways too. Structural differences, i.e. asymmetry, can be found either between the affirmative and negative constructions or between the paradigms that the affirmative and negative constructions form. These distinctions are defined and illustrated in connection with Map 113A, which shows the geographical distribution of symmetric and asymmetric standard negation.
Number of Non-Derived Basic Colour Categories,,, The following four maps (132A, 133A, 134A, 135A) show the distribution of colour terms in some of the world's languages, based on the World Color Survey. This project, a collaboration of researchers at the University of California, Berkeley, and the Summer Institute of Linguistics (SIL), collected colour-naming data from 110 languages being studied by SIL linguist-translators in the late 1970s. For further details on methods and results of the World Color Survey see Kay et al. (1991), Kay and Berlin (1997), Kay et al. (1997), Hardin and Maffi (1997), Kay and Maffi (1999).
Order of Numeral and Noun,,, This map shows the order of cardinal numerals with respect to a noun they modify. Cardinal numerals are words denoting the number of things referred to, as in English four chairs, in contrast to ordinal numerals, which specify the rank in some order of objects, as in English the fourth chair. See also Map 131A on numeral bases and Map 53A on ordinal numerals.
Periphrastic Causative Constructions,,, The causative construction is a linguistic expression which denotes a complex situation consisting of two component events (Comrie 1989: 165-166; Song 2001: 256-259): (i) the causing event, in which the causer does or initiates something; and (ii) the caused event, in which the causee carries out an action, or undergoes a change of condition or state as a result of the causer’s action. The following sentence in Kinyarwanda (Bantu; Central East Africa) is such a linguistic expression.
Ditransitive Constructions: The Verb 'Give',,, Ditransitive verbs are verbs with two arguments in addition to the subject: a “recipient” or “addressee” argument, and a “theme” argument. Typical ditransitive verb meanings are ‘give’, ‘sell’, ‘bring’, ‘tell’. Since different ditransitive verbs occur in different constructions in many languages, only a single verb meaning was taken into account for this chapter: the verb ‘give’, which is probably the most frequent ditransitive verb in all languages.
Adjectives without Nouns,,, Adjectives may occur either as predicates, for example This apple is red, or within noun phrases. When within noun phrases, they typically function as attributes to nouns, for example I want the red apple. However, in some cases, when the noun is either unimportant or is reconstructible from the discourse, it is absent from the construction, and, as a result, the adjective remains as the main lexical item within the noun phrase, denoting the understood object. An example of such a construction is the following:
Tone,,, All languages make use of variations in the musical pitch of the voice as part of their sound systems, but they differ in the ways in which modifications of pitch are used and how many different types of functions are served by pitch variations. Linguists distinguish between two of the major uses of pitch as tone and intonation. Intonation is the term that is used to describe sentence types, such as question versus statement, or to indicate whether a speaker has finished or intends to continue speaking, or to show which parts of an utterance present new or highlighted information versus old or less significant information.
Locus of Marking in the Clause,,, Locus is a convenient one-word term for what is also known as head/dependent marking. In any kind of phrase, overt morphosyntactic marking reflecting the syntactic relations within the phrase may be located on the head of the phrase, on a non-head (i.e. on a dependent), on both, or on neither. In clauses, the arguments are dependents and the verb is the head. Examples of the locus types in clauses are (1)-(4). For ease of illustration these examples show the treatment of subjects and objects, in languages that treat both identically. As discussed below, not all languages treat subjects and objects identically, and where they are treated differently we have mapped the treatment of objects (specifically, direct objects (P below)). Not all languages treat pronoun and noun arguments identically, and where they are treated differently we have mapped the treatment of nouns.
Voicing in Plosives and Fricatives,,, As noted in Chapter 5, one of the major ways that consonants differ from each other is in the accompanying action of the larynx, with the most typical larynx settings being one which allows air to flow freely between the vocal folds vs. one in which the vocal folds vibrate to produce regular voicing. One aspect of this opposition between voiced and voiceless consonants is discussed in Chapter 5. In this chapter the distribution of a contrast between voiced and voiceless counterparts in the two major classes of consonants within which this contrast commonly occurs will be discussed. These two classes of consonants are the plosives and fricatives. Plosives are the kinds of sounds usually associated with the letters p, t, k; b, d, g, in which air flow from the lungs is interrupted by a complete closure being made in the mouth. Fricatives are the kinds of sounds usually associated with letters such as f, s; v, z, in which the air passes through a narrow constriction that causes the air to flow turbulently and thus create a noisy sound. The other classes of consonants which are found in the majority of languages (nasals, "liquids" and vowel-like approximants) are voiced in the overwhelming majority of cases.
Position of Pronominal Possessive Affixes,,, Note that the term possessive affix is used by different linguists for two very different sorts of affixes. This chapter uses the term for affixes like those in (1) which code the person, number, and/or gender of a possessor and which appear on a noun denoting the entity which is possessed. The term is occasionally used for what will be called here genitive affixes, case affixes which occur on nouns denoting possessors, to indicate that these nouns denote the possessor of something expressed by a separate noun, as illustrated by the example in (2) from Archi (Nakh-Daghestanian; Russia).
Passive Constructions,,, The three examples of passive clauses given so far are personal passives, i.e. passives with an overt lexical subject. Personal passives are typically seen as involving a process of agent demotion (from subject to oblique role or total suppression) and a process of patient promotion (from direct object to subject). There are also passive clauses which involve only agent demotion. These are called impersonal passives. An example of an impersonal passive is given in (3b) from Kannada (Dravidian; southern India).
Alignment of Case Marking of Pronouns,,, The core argument of a canonical, one-place intransitive predicate may be symbolized S. The two core arguments of a canonical, two-place transitive predicate may be symbolized as A and P, with A representing the more agent-like argument and P the more patient-like (Comrie 1978). (In another terminology, the symbol O is used rather than P; Dixon 1994.) In studying the alignment of case marking, we ask the question which of S, A, and P are coded identically and which are coded differently. Note that for the purposes of this chapter, only case marking is considered. Alignment of person marking in the verb is treated in Chapter 100. Other manifestations of alignment are also possible, such as word order, but are not treated here.
Position of Interrogative Phrases in Content Questions,,, Content questions differ from polar questions (see Maps 92A and 116A) in that they elicit a specific answer other than ‘yes’ or ‘no’, and in containing interrogative phrases. All languages have a set of interrogative words that are characteristic of content questions, though in many languages they are identical in form to indefinite words (like someone  in English) (see Map 46A). These interrogative words typically belong to different categories (interrogative pronouns, interrogative adverbs, “interrogative adjectives”, “interrogative verbs”). Because most interrogative words in English begin with wh-, content questions in English are often called wh-questions. Although interrogative phrases often consist of single words (interrogative pronouns or interrogative adverbs), they may contain additional words, as in which book  in (1b).
Predicative Possession,,, This map illustrates the areal distribution of the various encoding options for predicative possession. The data base for this map thus includes sentences in which ownership of a certain object (the possessed item) is predicated of a possessor, in a way that is illustrated by the English sentence John has a motorcycle. It should be noted that the scope of this map is restricted by several conditions. First, the map deals only with the encoding of predicative possession, as in John has a motorcycle; cases of adnominal possession (as in John’s motorcycle) are not dealt with. Secondly, within predicative possession it often matters whether the noun phrase that indicates the possessed item is indefinite or not. English is a language in which this parameter gives rise to two different encoding options (see 1a-b). For the purposes of this map, only constructions in which the possessed NP has an indefinite reading - i.e., only those constructions that are parallel to (1a) - have been taken into account.
Indefinite Pronouns,,, This chapter examines indefinite pronouns like 'somebody' and 'something' and distinguishes two major types. On the one hand, they may be closely related to the interrogative pronouns 'who' and 'what', as in Russian, where kto-to  'somebody' and čto-to  'something' are derived from kto  'who' and čto  'what' by means of the indefinite suffix -to. On the other hand, they may be closely related to the generic nouns 'person' and 'thing', as in Persian, where 'somebody' is expressed as kæs-i  [person-indef] and 'something' is expressed as čiz-i  [thing-indef]. In addition to the two major types, there are some languages with special expressions for 'somebody' and 'something', unrelated to anything else. An example is Abkhaz (Northwest Caucasian), where 'somebody' is aj˚ə̀  and 'something' is ak'ə̀  (Hewitt 1979: 158). Theoretically one might expect further types, e.g. indefinites derived from demonstrative pronouns, but no other types have been found.
Postverbal Negative Morphemes,,, Nothing found on this topic!
Obligatory Double Negation,,, Nothing found on this topic!
Preverbal Negative Morphemes,,, Nothing found on this topic!
Optional Double Negation,,, Nothing found on this topic!
Order of Negative Morpheme and Verb,,, Not considered are negative constructions involving more than simple clausal negation, like (2a), or clauses with nonverbal predicates, like (2b) to (2d), in languages where one or more of these is treated differently from clauses with verbal predicates, negative imperative (prohibitive) sentences, like (2e), or constituent negation, where a non-verbal constituent is the focus of the negation, as in (2f).
Minor morphological means of signaling negation,,, Nothing found on this topic!
Optional Triple Negation,,, Nothing found on this topic!
Noun Phrase Conjunction,,, This map shows the distribution of the variation in the encoding of noun phrase conjunction. The basic distinction is between those languages which use a different marker for noun phrase conjunction and comitative phrases (so-called and-languages; Stassen 2000) and those languages in which the markers for noun phrase conjunction and comitative phrases are the same (with-languages). A clear example of an and-language is English. As the examples in (1) demonstrate, in this language the marker of noun phrase conjunction (and ) is different from the marker of comitative phrases (with). In contrast, the example in (2) shows that Nkore-Kiga (Bantu; Uganda) is a with-language: the item na  can be translated as either 'and' or 'with'. An alternative way of stating this is to say that with-languages like Nkore-Kiga lack the structural option of noun phrase conjunction.
M-T Pronouns,,, Personal pronouns, like other closed-class forms, tend to contain nasals and other basic consonants.  However, particular paradigmatic combinations of consonants in particular person-number categories are not especially frequent worldwide. There are only two such combinations that show up interestingly on a map: pronoun sets like English me  and thee  or Nanai (Tungusic; eastern Siberia) mi  'I, me' and si  'you', with m  in the first person and a coronal obstruent in the second, which are common in northern Eurasia and rare elsewhere; and sets like Northeast Maidu (Penutian; California) ni  'I, me' and mi  'you' with n  in the first person and m  in the second, which are common in western America and rare elsewhere. Map 136A here shows the first type, henceforth "m-T"  patterns, and Map 137A the second, henceforth "n-m"  patterns.
M in First Person Singular,,, Nothing found on this topic!
Comparative Constructions,,, In semantic or cognitive terms, comparison can be defined as a mental act by which two objects are assigned a position on a predicative scale. If the positions on the scale are different, then we speak of the comparison of inequality, which finds its linguistic encoding in comparative constructions. Such a construction essentially involves three things: a predicative scale, which, in language, is usually encoded as a gradable predicate, and two objects. Although these objects can, in principle, be complex, the practice of typological linguistic research has been to restrict them to primary objects, which are typically encoded in the form of noun phrases. Thus, a comparative construction typically contains a predicate and two noun phrases, one of which is the object of comparison (the comparee NP), while the other functions as the "yard-stick" of the comparison (the standard NP). In short, prototypical instances of comparative constructions in the languages of the world are sentences that are similar to the English sentence in (1), in which the noun phrase following the item than is the standard NP:
Antipassive Constructions,,, An antipassive construction is a derived detransitivized construction with a two-place predicate, related to a corresponding transitive construction whose predicate is the same lexical item. In the basic transitive construction, the patient-like argument is realized as a direct object; in the antipassive construction, that argument is either suppressed (left implicit) or realized as an oblique complement. The term antipassive (Silverstein 1972) was coined to indicate that the construction is a mirror image of the passive: in the passive, the suppressed or demoted argument is the agent-like argument, in the antipassive, the patient-like argument. An example of a transitive/antipassive alternation is given in (1a-b).
Productivity of the Antipassive Construction,,, Antipassives often apply only to a certain subset of transitive predicates (Gibson 1980; Chung 1998: 39). Productive antipassives show genealogical and areal clustering, as indicated on Map 108B: they are found in some Mayan, Salishan, Nakh-Daghestanian, Austronesian, and Australian languages.
Overlap between Situational and Epistemic Modal Marking,,, Modality is a dimension of meaning that crucially involves notions of possibility and necessity. These may relate to circumstances that allow or necessitate a situation, as in (1). The permission in (1a) is a matter of the speaker allowing a situation, while with the obligation of (1b) the situation of the addressee’s going home is deemed necessary.
