Feature_Name,,, Feature_Definition
Case Syncretism,,, This map shows instances of case syncretism in nominals (nouns, pronouns and adjectives). We identify case syncretism when a single inflected form corresponds to two or more case functions. The criterion used here for identifying case functions is form-based: a distinct morphosyntactic case is recognised for a language if it is ever correlated with a formal inflectional distinction (Comrie 1991: 44-47). For example, in Krongo, subject and object forms are never distinguished, so this is not construed as an example of case syncretism, but rather as a single nominative-accusative case (see (1)). However, the dative case is distinct in nouns but identical to this nominative-accusative form in pronouns, so a dative = nominative-accusative syncretism is recognised for Krongo. The formal criteria for identifying syncretism may also be found within the paradigm of a single word, as in Central Yup’ik, where the absolutive and relative (a case combining the functions of ergative and genitive) are distinct in the singular but not in the plural or dual (see (2)).
Tea,,, This chapter differs from most of the chapters in the atlas in several ways, the focus being on the actual phonological shape of a lexical item expressing a particular concept - moreover, one that is definitely not part of the universal heritage of mankind but rather is connected to a specific agricultural product. What is shown on the map are the sources of the words for ‘tea’ in various languages in the world, illustrating in a somewhat peculiar way the spread of words together with material culture. In particular, the map shows the importance of long-distance contacts, such as the trade relations between European countries and East Asia, and is thus a healthy reminder of the fact that languages need not be geographically contiguous to influence each other. Also, in contrast to, for example, the patterns illustrated in the chapters on M-T and N-M pronouns (Chapters 136-137), which presumably go far back in linguistic prehistory, the distribution of words for ‘tea’ depends on quite recent historical processes.
Locus of Marking: Whole-language Typology,,, Locus is a convenient one-word term for what is also known as head/dependent marking. In any kind of phrase, overt morphosyntactic marking reflecting the syntactic relations within the phrase may be located on the head of the phrase, on a non-head (i.e. on a dependent), on both, or on neither. In possessive phrases, the possessed noun is head and the possessor is dependent. Examples illustrating marking of various kinds in possessive phrases are given in Chapter 24. In clauses, the arguments are dependents and the verb is the head. Examples of the locus types in clauses are given in Chapter 23. The division into head, dependent, double, and zero marking does not exhaust the possible types; see the same chapters for examples of additional minor locus patterns.
Zero Marking of A and P Arguments,,, Nothing found on this topic!
The Associative Plural,,, Associative plural constructions consist of a noun X (typically of human reference, usually a person's name or a kin term) and some other material, most often an affix, a clitic, or a word. The meaning of the construction is ‘X and other people associated with X’. An example is Japanese Tanaka-tachi  ‘Tanaka and his associates’.
Relationship between the Order of Object and Verb and the Order of Adjective and Noun,,, This map shows the relationship between the order of object and verb and the order of adjective and noun; these two features are shown on Maps 83A and 87A. This map is the third map showing the relationship between two typological features. Unlike the two previous maps, however, there is no correlation between the features or implicational relationship relating them: all four types defined on the intersection of these two features, the first four types shown in the value table, are common.
Order of Object and Verb,,, This map shows the dominant order of lexical (nonpronominal) object and verb. As with Map 81A, the notion of object is defined semantically, as the P or most patient-like argument (see discussion under Map 81A) in a transitive clause. The primary types shown are languages which are OV (in which the object precedes the verb), illustrated by Turkish in (1a), and languages which are VO (in which the verb precedes the object), illustrated in (1b) by Gulf Arabic, the variety of colloquial Arabic spoken in Kuwait, Bahrain, Qatar, the United Arab Emirates, and eastern Saudi Arabia.
Position of Tense-Aspect Affixes,,, This map shows the position of tense-aspect affixes. The primary distinction is between tense-aspect prefixes, as illustrated by the past tense prefix ā-  in (1a) from Anywa (Nilotic; Ethiopia and Sudan), and tense-aspect suffixes, illustrated by the imperfective suffix -n  in (1b) from Harar Oromo (Cushitic, Afro-Asiatic; Ethiopia).
Alignment of Case Marking of Full Noun Phrases,,, These two maps are concerned with the ways in which core argument noun phrases are marked — by means of morphological case or adpositions — to indicate which particular core argument position they occupy. The first map is concerned with full noun phrases, the second with pronouns.The core argument of a canonical, one-place intransitive predicate may be symbolized S. The two core arguments of a canonical, two-place transitive predicate may be symbolized as A and P, with A representing the more agent-like argument and P the more patient-like (Comrie 1978). (In another terminology, the symbol O is used rather than P; Dixon 1994.) In studying the alignment of case marking, we ask the question which of S, A, and P are coded identically and which are coded differently. Note that for the purposes of this chapter, only case marking is considered. Alignment of person marking in the verb is treated in Chapter 100. Other manifestations of alignment are also possible, such as word order, but are not treated here.
The Future Tense,,, In English, the sentence It is cold tomorrow, with the present tense of the copula is, sounds strange: it is more natural to say It will (it’ll) be cold tomorrow  or It is going to be cold tomorrow, using a future tense form. In Finnish, on the other hand, one may replace the adverb tänään  ‘today’ in (1) with huomenna  ‘tomorrow’, yielding (2) without any further changes in the sentence.
Definite Articles,,, This map shows information regarding definite articles. For the purposes of this map, a definite article is a morpheme which accompanies nouns and which codes definiteness or specificity, like ‘the’ in English. This is a somewhat broader use of the term definite article  than is common, since it includes (i) affixes on nouns that code definiteness; and (ii) demonstratives, if those demonstratives are used as markers of definiteness. In many languages, words that are demonstratives, either in the sense that they can be used deictically with an accompanying gesture or in the sense that they exhibit a distinction in terms of distance (as in the contrast of this  and that  in English), are also widely used in contexts where English would use a definite article rather than a demonstrative.
Lateral Consonants,,, In their consonant inventories most of the languages in the world have a consonant sound similar to that represented by the l in English lake, Spanish lobo ‘wolf’, or Indonesian laki ‘husband’. The technical phonetic description of sounds of this type is that they are voiced lateral approximants produced at the dental or alveolar place of articulation. The word lateral in this description refers to the fact that during their production the flow of air originating from the lungs is directed around a region of contact between the tongue and the roof of the mouth which leaves a passage for the air to escape to one or both sides of this central closure. The size of the channel through which the air flows is wide enough that the flow is unimpeded and does not create friction noise as it passes, and the vocal folds are in the normal position to produce voicing vibrations in the same way as is typical during vowel sounds. Sounds with lateral airflow are most often produced with the tip or blade of the tongue making contact with the back of the upper teeth or at a position just behind the teeth; hence they are labeled dental or alveolar. If you pronounce the “l-sound” of a language familiar to you but then keep the tongue in the same position and draw the breath quickly inwards the colder inward-flowing air will help you feel where the side passage for airflow is located.In this chapter the occurrence of laterals of this common type and of various other kinds of lateral consonants that are less frequently found will be described, as well as the distribution of languages that have no lateral consonants. As in other chapters discussing aspects of consonant inventories, the set of sounds under consideration is the set of contrasting sounds as represented by their most typical pronunciation (see Chapter 1).
Voicing and Gaps in Plosive Systems,,, In this chapter we will look at some patterns found within the sets of stop consonant sounds in the world’s languages. It will emerge that two well-known patterns, here labeled "missing /p/" and "missing /g/", which were previously considered to reflect universal phonetic factors in an equal way, are quite differently distributed. This difference suggests that these patterns are not in fact parallel.
Relativization on Subjects,,, According to the Accessibility Hierarchy of Relativization (subject > direct object > indirect object > possessor) proposed in Keenan and Comrie (1977), it is easier to relativize on subjects than it is to relativize on any of the other positions, easier to relativize on direct objects than indirect objects, etc. One of the generalizations that has been made regarding the accessibility hierarchy is that the pronoun retention strategy is preferred at the lower end of the hierarchy. This finds substantial confirmation in the present study, in that several languages use pronoun retention for relativizing upon obliques but not for relativizing upon subjects. In fact, few languages use pronoun-retention to relativize upon subjects
Numeral Classifiers,,, In English and in other languages, nouns may vary with respect to the property of countability. Nouns of high countability such as woman, dog and pencil  denote objects which are conceptualized in terms of highly individuated units typically associated with a characteristic shape. In contrast, nouns of low countability such as water, sand  and smoke  denote objects which are conceptualized in terms of masses without unitary structure or characteristic shape.Countability bears a number of grammatical consequences, one of which is the way in which nouns may occur in construction with numerals. Nouns of high countability generally occur in direct construction with numerals, for example one woman, two dogs, three pencils. In contrast, nouns of low countability typically do not occur in direct construction with numerals; instead, an additional item must be present, for example one glass of water, two pounds of sand, three plumes of smoke. Such additional items are sometimes referred to as mensural numeral classifiers, since they provide nouns of low countability with a unit of measure by means of which they may then be counted.
Number of Cases,,, Morphological case on nominals is a common device to express the syntactic and semantic relationships between clausal constituents. However, the languages of the world that use this strategy vary greatly with respect to the number of case categories represented in their inflectional system. It is the purpose of this map to display this numerical variation in the productive case paradigms of substantives (full nouns) in 261 languages. Deviant case inventories found in minor word classes of particular languages are dealt with in Chapter 50.
Semantic Distinctions of Evidentiality,,, This map and the one following it show the presence of grammatical markers of evidentiality. On this map the semantic coding of evidentiality is represented, while Map 78A deals with the morphological coding of evidentiality.
Possessive Classification,,, Many languages have more than one way of forming possessive noun phrases. English, for example, has a choice between the "Saxon genitive" (Mary's house, the director's office, the day's end) and the "Norman genitive" (the office of the director, the end of the month), conditioned in part by the part of speech and semantics of the possessor but with considerable overlap and stylistic variation.In contrast, many languages have an opposition of two (or sometimes more) forms of possessive marking whose choice is conditioned not by semantics or style, as in English, but lexically; and conditioned not by properties of the possessor but by the possessed noun, i.e. by the head noun in the construction. (The possessed nouns in the English examples above are house, office, and end.) Consider the examples in (1) from Mesa Grande Diegueño (Yuman; California), where the noun 'mother' takes the simple prefix ʔ-  'my' while 'house' takes the compound prefix ʔə-nʸ-.
Third Person Zero of Verbal Person Marking,,, Map 103A represents the distribution of third person zeroes among verbal person markers of the sole argument of an intransitive clause (i.e. of the S argument). I have chosen to depict the person marking of the S rather than of either of the transitive arguments, as the verbal person markers of the latter are sometimes fused with each other (see Chapter 104), which makes it difficult to decide which one has a zero realization.
Front Rounded Vowels,,, The lip position of vowels is generally correlated with the height and backness of the vowel, as discussed in Chapter 2. Normally vowels which are back and not low are pronounced with the lips in a rounded position (e.g. [o] and [u]). Front and central vowels and back low vowels are normally pronounced with the lips unrounded (e.g. [i], [e], [a]). Lip rounding involves drawing the corners of the lips together and protruding the lips forward from their normal rest position. The ability to make these gestures with the lips is greatest when the vowel is high; as the jaw is opened further to make progressively lower vowels, the amount of adjustment of the lips that is possible becomes more limited, since the lips are being stretched vertically. This mechanical constraint may account for the fact that low vowels are normally unrounded, whether front or back. As for non-low vowels, the association of lip rounding with back vowels has to do with reinforcing the low-pitched acoustic overtones that are characteristic of back vowels. Rounding and protruding the lips lowers the frequencies of the acoustic resonances of the vocal tract to add to the lowering effect produced by the action of backing the body of the tongue. A rounded back vowel is therefore more clearly distinct from other vowels than an unrounded one (see Stevens 1972).Although the occurrence of lip rounding with back non-low vowels is the normal pattern, front vowels with lip rounding and back non-low vowels without lip rounding do both occur in the inventories of vowels of a minority of languages. This chapter will focus on the occurrence of one class of these less usual vowels, the front rounded vowels. In the sample of languages surveyed for this chapter, there are only 37 languages (about 6.6%) in which one or more such vowels are recognized as part of the vowel inventory as defined in Chapter 2.
Conjunctions and Universal Quantifiers,,, Conjunctions are forms with meanings similar to that of English and. Universal quantifiers are expressions with meanings resembling those of English every, each, and all.Logicians, as well as logically-minded linguists, have suggested that there is a close affinity between conjunctions and universal quantifiers. For example, in the context of a class consisting of five students, Alice, Bill, John, Mary and Susan, sentence (1) with the conjoined NP Alice, Bill, John, Mary and Susan  is logically equivalent to sentence (2) with the universally quantified noun phrase every student.
The Morphological Imperative,,, The first type shown on the map includes languages that have special morphological marking both for the imperative second singular and for the imperative second plural, as in example (1) from Limbu (Tibeto-Burman; Nepal).
Hand and Arm,,, This map shows the distribution of the two primary ways in which languages lexically recognize major segments of the human upper limb. The major segments are 'hand,' from the fingertips to the wrist, and 'arm,' from the fingertips or from the wrist to the shoulder. 
Gender Distinctions in Independent Personal Pronouns,,, Independent personal pronouns, in contrast to bound forms (i.e. clitics and affixes), are separate words capable of taking primary stress. Virtually all languages have independent personal pronouns, though in some they occur rather infrequently. Gender, as defined by Corbett (1991), is a form of classification of nominals, as shown by agreement (see Map 30A). Most gender contrasts on personal pronouns are sex-based, i.e. pronouns used for male referents are masculine and those used for females are feminine. The treatment of other referents varies. They may be referred to by a separate set (or sets) of neuter pronouns, as is the case in English and many other European languages. Alternatively, they may be grouped with the referents of masculine gender (e.g. Amharic), or less commonly with the referents of feminine gender (e.g. Warekena), or split over the masculine and feminine genders in an arbitrary way or according to some semantically based principle (e.g. Garifuna).Gender oppositions in personal pronouns are characteristic of the third rather than the first or second person. This is suggested by Greenberg (1963: 96) Universal 44: “If a language has gender distinctions in the first person, it always has gender distinctions in the second or third person or in both”. Moreover, gender is seen as being typical of singular rather than non-singular personal pronouns. This, in turn, is expressed in Greenberg’s Universal 45: “If there are any gender distinctions in the plural of the pronoun, there are some gender distinctions in the singular also”. There are some exceptions to universals 44 and 45 involving independent person pronouns, but not many (cf. especially Plank and Schellinger 1997). 
The Prohibitive,,, This map shows the grammaticalization of a prohibition addressed to a single addressee. The category will be called the “second singular prohibitive”. Four values will be distinguished.
Situational Possibility,,, The map gives some indication about the kind of strategy used to express situational possibility in positive main clauses. Three types of languages are distinguished. The definitions make reference to three marking strategies: affixes on verbs, verbal constructions, and other constructions, ordered in terms of increasing cross-linguistic frequency. The first type on the map comprises languages that use the least frequent strategy, whether or not they also use the more frequent ones. Languages of the second type use the medium frequency (but not the low frequency) strategy, whether or not they also use the most frequent ones. Languages of the third type use only the most frequent strategy.
Position of Case Affixes,,, This map shows the position of case affixes on nouns, especially whether they are prefixes, as in the example in (1a) from Krongo (Kadugli; Sudan), or suffixes, as in (1b) from Tsova-Tush (Nakh-Daghestanian; Georgia).
Order of Subject and Verb,,, This map shows the dominant order of lexical (or nonpronominal) subject and verb. The primary types are languages which are SV (in which the subject precedes the verb), a type represented by English and by Turkish, as illustrated in (1a), and languages which are VS (in which the subject follows the verb), exemplified by Welsh, as illustrated in (1b).
Ordinal Numerals,,, This article surveys the global distribution of morphological patterns that connect ordinal numerals with cardinal numerals. We associate these two classes of numerals with different functional domains: By cardinal numerals, we understand the set of numerals used in attributive quantification of nouns (e.g. 'four days'). Ordinal numerals typically identify the position a given member of a set occupies relative to other members of the same set (e.g. 'the fourth day'). The main functions of ordinal numerals thus comprise the identification of ranks within a hierarchy and the identification of the temporal order in a sequence of events or the like. For more information on numerals, see Hurford (1975, 1987).We look at the formal relationship that obtains between cardinal numerals and their ordinal counterparts, i.e. we study morphological and syntactic (periphrastic) ways of deriving ordinals from cardinals. However, we exclude non-morphological marking by word order (cf. §2.2). Furthermore, we restrict our investigation to the first decade (i.e. to the values 1 through 10), because in many languages numeral systems do not go beyond ten, or the use of ordinal numerals is optional with higher numerical values. For the sake of brevity, our examples below list numerals up to value 5. The derivational dependence of ordinal numerals on cardinal numerals is the cover term for regular morphological derivation according to the synchronically valid rules of a given language, and also for all those cases where the morphological relation is of a purely historical nature, so that the word-form of the ordinal numeral reflects obsolete derivational rules of an earlier stage of the same language. Otherwise we consider ordinal numerals derivationally independent of their cardinal counterparts, or in other words, suppletive.
Nominal and Locational Predication,,, This map shows the possible relationships between the encoding of nominal and locational predicates. In particular, the map shows for each language whether nominal predications (such as John is a tailor) and locational predications (such as John is in Paris) can or cannot be encoded by the same strategy. In the terminology of Stassen (1997), a language is called a share-language if the encoding strategy for locational predications is (or can be) used for nominal predications, and a split-language if the encoding strategies for the two constructions must be different.
Reciprocal Constructions,,, Map 106A displays different ways in which languages encode reciprocal situations, i.e. situations like ‘They love each other’. The reciprocal situation comprises at least two simple situations (e.g., She loves him and He loves her), so one way to encode such a situation is to combine expressions for two simple situations, as seen in (1) from Cantonese:(1) Cantonese (Matthews and Yip 1994: 87)Ngóhbéi-minkéuihkéuihbéi-minngóh.Igive-facehimhegive-faceme‘He and I respect each other.’Apparently, this strategy of encoding reciprocated situations is possible in all languages, although the extent to which such a pattern is conventionalized in grammar and common in actual discourse differs from language to language. However, most languages also have simple or complex reciprocal markers (verbal affixes, pronouns, particles, adverbs, etc.), which, if combined with a verb within one clause, signal that the clause describes a reciprocal situation and not just the situation denoted by this verb, without repeating the verb for each simple situation. For example, English has two pronominal reciprocal markers, each other and one another; and in Kolyma Yukaghir (eastern Siberia), there is one reciprocal marker which is prefixed to the verb stem:
Expression of Pronominal Subjects,,, Across languages, we can distinguish two types of simple sentences differing in the nature of their subjects. One sort of simple sentence involves a nominal subject, a subject consisting of a noun, plus possibly some modifiers. The second sort of simple sentence involves a pronominal subject, where there is no nominal subject and where the subject is expressed at most by a morpheme or morphemes coding semantic or grammatical features of the subject, such as person, number, or gender. Thus, the English example in (1a) is a simple sentence with a nominal subject, while (1b) is a simple sentence with a pronominal subject.
Question Particles in Sign Languages,,, For the purpose of this chapter, question particles are defined as signs whose main function is to indicate that an utterance is a question. Question particles are distinct from tag questions in that the latter involve an intervening intonational break, with only the tag marked by an interrogative facial expression (example 1). They are also distinct from question introducers and pragmatic question markers. The latter mainly have a pragmatic function, carrying a more specific meaning such as expressing the speaker’s attitude towards the content of the utterance, and they may also be prosodically detached from the rest of the utterance (example 2).
