Feature_Name,,, Feature_Definition
Asymmetrical Case-Marking,,, Morphological case inflection is an efficient strategy for encoding syntactic relationships. Therefore one might naively expect that case-marking languages should use it consistently, by applying the same case categories to all nominal expressions occurring in the appropriate syntactic positions. Indeed, there are many case-marking languages of this kind. Such languages exhibiting identical sets of case categories for all nominals are called case symmetrical. Other languages, however, apply case marking more selectively across their lexicon, restricting the occurrence of certain (or all) cases to a subset of their nominals. The different subsets of nominals therefore display different case inventories. This typological property of languages is called case asymmetry, and the languages themselves, case asymmetrical. 
Irregular Negatives in Sign Languages,,, The term irregular negative refers to several types of forms that will be called negative suppletion and negative derivation here. They all have in common that they express negation in a non-standard way. The canonical marking of negation in sign languages involves, on the one hand, negative particles that are independent signs and, on the other hand, non-manual negative signals (head movements and facial expressions) that co-occur with the negated signs. Neither the negative particles nor the non-manual negative signals affect the form of the sign or signs being negated. In example (1), from Indo-Pakistani Sign Language, there is a clause-final negative particle, and the non-manual negative signal is a headshake (indicated by the line labelled “neg” on top of the sign glosses). The negated predicate ‘interesting’ takes the same form as it would in a positive clause.
Presence of Uncommon Consonants,,, In this chapter the worldwide pattern of occurrence of four rather unusual classes of consonants will be discussed. These four classes are clicks, labial-velar plosives, pharyngeals, and dental or alveolar non-sibilant fricatives. This last class includes sounds similar to those represented by the th in English words such as this or thing; for brevity they will often be referred to as “th” sounds in the text. Each of these classes of consonants occurs in relatively few languages, but they exemplify different patterns of geographical distribution, some being concentrated in particular areas while others are dispersed. The occurrence of these consonants in the consonant inventory as discussed in Chapter 1 was examined in a sample of 566 languages. Since each of the four types of consonants being discussed is relatively rare, the great majority (448, or 79.2%) of the languages do not have any of them. However, viewing the world on a large scale, at least one of these special kinds of consonants tends to be found in at least some language in all major areas.
Glottalized Consonants,,, In this chapter the distribution of consonants whose production involves certain special actions of the larynx will be discussed. In the great majority of consonant sounds, the vocal folds inside the larynx are either open so that air from the lungs can freely flow into the mouth, or they are brought close together so that air flowing between them causes them to vibrate, producing the effect called voicing (as discussed in Chapters 1, 4 and 5). All languages have some sounds which are voiceless, that is, are produced with open vocal folds, and some which are voiced. In addition to these two settings there are other, less commonly used adjustments of the larynx involving either a tighter constriction of the vocal folds and/or a movement of the larynx a short distance up or down in the throat. Consonants with these characteristics are known as glottalized (from the word glottis, the name given to the space between the vocal folds).
Pronominal and Adnominal Demonstratives,,, Demonstratives are commonly divided into pronominal demonstratives, which substitute for a noun (phrase), and adnominal demonstratives, which accompany a coreferential noun. In English, pronominal and adnominal demonstratives have the same forms: this  and that  may function as independent pronouns, as in (1a), or they may cooccur with a noun, as in (1b).
Number of Basic Colour Categories,,, These are the two pairs of fundamental opponent chromatic colours <Red, Green> and <Yellow, Blue> and the single pair of fundamental achromatic colours <Black, White>. Black and white are not opposed in the same sense as the chromatic pairs. For example, we can see a combination of black and white (gray) but there is no sensation consisting of the combination of red and green or of blue and yellow. (That blue and yellow pigments can be mixed to produce a green pigment is not relevant; there are no bluish yellow or yellowish blue sensations.)
Suppletion According to Tense and Aspect,,, The maps in this and the following chapter show the distribution of suppletion in verb paradigms according to tense-aspect, imperative and hortative moods, and verbal number. Suppletion is defined as the phenomenon whereby regular semantic relations are encoded by unpredictable formal patterns. Cases where the paradigmatically related forms share some phonological material are examples of weak suppletion, as in English buy vs. bought, while cases with no shared phonological material are instances of strong suppletion, as in English go vs. went (Dressler 1985). These types reflect two ends of a continuum rather than an either-or opposition. Mel’čuk (1994) also introduces the criterion of uniqueness, i.e. in order to be classified as suppletive, the alternation shown between two paradigmatically related forms should be unique, in that no other two forms in the language show exactly the same morphophonological alternation, as in Spanish digo ‘say.pres.1.sg’ vs. dije ‘say.pret.1.sg’. The maps concentrate on strong and unique cases.
Suppletion in Imperatives and Hortatives,,, Nothing found on this topic!
Genitives, Adjectives and Relative Clauses,,, In English, as evident in (1), these three semantic functions are coded by means of three different morphosyntactic constructions: in (1a) the attributive expression precedes the head and is marked with the possessive enclitic 's, in (1b) the attributive expression precedes the head but is unmarked, and in (1c) the attributive expression follows the head and is marked with the complementizer that. Based on paradigms such as the above in English and in other languages, grammarians distinguish between three different types of constructions, genitives, adjectives and relative clauses, of which the above are typical examples.
Vowel Nasalization,,, This chapter deals with the distribution of contrastive vowel nasalization in the world’s languages. The existence of contrastive nasal vowels is well known in some languages, e.g. French /pɛ̃/ pain ‘bread’ vs. /pɛ/ paix ‘peace’. About a quarter of the languages in our sample have a nasal–oral vowel contrast.
Nasal Vowels in West Africa,,, Map 10B shows the complexity of nasal vowel systems in West Africa, an area already identified as having a high density of such systems. It distinguishes among languages that have no nasal vs. oral contrast, those with only a two-way oral vs. nasal contrast, and those that have larger four-way systems incorporating vowel length. It also indicates which languages also have some kind of nasal spreading across segments. 
Verbal Number and Suppletion,,, This chapter shows the distribution of suppletion according to verbal number. The term verbal number requires some clarification: number as a verbal category can reflect the number of times an action is done or the number of participants in the action. When we say that a verb or verb phrase in an Indo-European language, say French, is in the plural, as in ils étaient fatigués  ('they were tired'), what we mean is that the verb phrase étaient fatigués  agrees with the subject ils  in number. The term plural verbs (or pluractional verbs) in many of the languages to be discussed below, on the other hand, refers to any or all of the following senses: the action is performed several times (iterative), or at several places (distributive), or the action affects or involves several participants. For example, Mupun (West Chadic; Nigeria) uses derivational means such as infixation in (1a), suffixation in (1b) or completely different verbs in (1c) to express plural action or plural participants.
Purpose Clauses,,, This chapter investigates the form of the verb in purpose clauses. Following a common practice in typological research (see among others Stassen 1985 and Croft 1990: ch.1), purpose clauses are defined in functional rather than morphosyntactic terms, as the latter turn out to be of restricted applicability in cross-linguistic comparison. A purpose construction is regarded as one encoding a particular relation between events. This relation is such that one of the linked events (the one coded by the main clause, or the main event) is performed with the goal of obtaining the realization of another one (the one coded by the purpose clause, or the dependent event). Typical cases of purpose relations involve motion predicates in the main event, as in (1). In this case, main and dependent event share a participant. However, non-motion predicates may also be involved, in which case main and dependent event need not share a participant, as is shown by (2)
Obligatory Possessive Inflection,,, In many languages with head-marked possession (see Chapter 24) some nouns obligatorily require possessive inflection and cannot be used alone. For example, the nouns illustrated in (1) and (2) from Navajo (Athabaskan; New Mexico and Arizona) and Acoma (Keresan; New Mexico) cannot stand alone and require possessive inflection.
Number of Possessive Nouns,,, The typological antithesis to obligatorily possessed nouns is nouns that cannot take the head-marked possessive inflection available in the language. There are a number of languages with such non-possessible nouns in our sample, and most of these languages have nouns conventionalized or grammatically specialized for use in apposition to the possessed noun and bearing the inflectional possessive marking which the head noun cannot bear. For instance, in Guaraní (Tupi-Guarani; Paraguay), various nouns including animal names cannot take the usual head-marked possessive inflection. In the event that possession needs to be expressed for such a noun one or another abstract or generic noun is put in apposition to the semantically possessed non-possessible, and that abstract or generic noun is inflected for possession
Fixed Stress Locations,,, This and the next three Chapters (15, 16, 17) report on word stress and word rhythm in the world's languages. The data were collected for a project called StressTyp and are also available on-line (see Goedemans and van der Hulst, forthcoming). The StressTyp database contains 510 languages, based on written primary and secondary sources (such as grammars and typological studies). StressTyp naturally only documents languages that have stress and therefore does not provide data about the numerous languages that are reported to lack stress, often tonal languages. In these chapters, ancient or extinct languages are excluded in accordance with the general policy of this atlas, so that the maps are based on a sample of 500 languages.
Distributive Numerals,,, Most languages have a series of cardinal numerals such as English one, two, three, and so on. Some of the ways in which such numerals are formed are described in Chapter 131. In addition, most languages also have various other series of numerals, whose forms are derived from cardinal numerals, and whose denotations combine the concept of number with other concepts of a variety of different kinds. Perhaps the most well-known of these other series are the ordinal numerals, described in Chapter 53. This map is concerned with one of the many other kinds of numeral series, namely, distributive numerals.
Perfective/Imperfective Aspect,,, The distinction between imperfective and perfective plays an important role in many verb systems and is commonly signalled by morphological means (rather than being expressed periphrastically). A particularly straightforward case is found in Rendille (East Cushitic; Kenya). Nonstative verbs in Rendille distinguish two basic forms, one which normally ends in -a  and one which normally ends in -e, as illustrated by the examples in (1).
Plurality in Independent Personal Pronouns,,, Somewhat paradoxically, the plural of personal pronouns has been considered both as a core phenomenon of nominal number and as something that has nothing to do with it. On the one hand, several scholars have suggested that if a language has a number distinction anywhere, then it has it at least in pronouns, or, speaking in diachronic terms, that plurality has spread from plural personal pronouns to other nominals (cf. Forchheimer 1953). On the other hand, linguists have repeatedly argued that pronominal plurals are different from nominal plurals in that the two have a different reference structure. Thus, it is observed that ‘we’ is not the same as ‘I + I + … I’ (e.g. Benveniste 1966a, Barulin 1980; cf. also Corbett 2000: 83-84). This chapter provides an account of what types of formal correlations between plurals and singulars are actually observed in personal pronouns, and how the devices for expressing pronominal plurality relate to the devices for expressing nominal plurality. It is based on 260 languages, including the 200 languages of the WALS sample, and will thus contribute further empirical data to the discussion. 
Systems of Gender Assignment,,, In Chapters 30 and 31 we have seen how we as linguists analyze gender systems, and establish how many genders there are. The remaining question is how the speaker assigns nouns to those genders. In other words, if a speaker of Russian uses the word kniga  ‘book’ or djadja  ‘uncle’, how does he or she "know" the gender? Clearly speakers must know the gender in order to be able to make the appropriate agreements. A model of the way in which speakers allot nouns to genders is called a gender assignment system.
Coding of Nominal Plurality,,, This map shows the method by which a language indicates plurality with nouns. There are basically two ways in which languages indicate plurality. The first (and most common) involves changing the morphological form of the noun, as in English dog, dogs. The second involves indicating plurality by means of a morpheme that occurs somewhere else in the noun phrase, illustrated by the plural word in the example in (1) from Hawaiian, where the word mau  has the same function as the plural suffix in English, but is a separate word modifying the noun.
Order of Subject, Object and Verb,,, The terms subject  and object  are used here in a rather informal semantic sense, to denote the more agent-like and more patient-like elements respectively. Their use here can be defined in terms of the notions S, A, and P, where the S is the single argument in an intransitive clause, the A is the more agent-like argument in a transitive clause, and the P is the more patient-like argument in a transitive clause. For the purposes of this map, then, the term subject  is used for the A while the term object  is used for the P. A language shown on the map as SOV could thus also be equally well and perhaps more accurately described as APV. Note that many linguists use the terms subject  and object  somewhat differently from this, and some linguists question the applicability of these terms to some languages, but these issues do not arise with the use of these terms here. For example, there is controversy surrounding the question of what ought to be considered the subject in Philippine languages, like Cebuano (cf. Schachter 1976). Cebuano has two common ways to express transitive clauses, one of which is illustrated in (3).
Languages with two Dominant Orders of Subject, Object, and Verb,,, Type 2 represents languages which are SVO/VSO. The fact that there are half as many languages of this type compared to SOV/SVO languages while there are more than five times as many SOV as VSO languages means that the ratio of SVO/VSO to VSO is higher than the ratio of SOV/SVO to SOV. In other words, the frequency of Type 2 is greater than we might expect. The high number of Type 2 languages relates to Universal 6 of Greenberg (1963): “All languages with dominant VSO order have SVO as an alternative or as the only alternative basic order”. Although there may be exceptions to Greenberg's universal, the fact that VSO languages generally allow SVO as an alternate word order makes it unsurprising that we would find many SVO/VSO languages. A number of the Type 2 languages occur in genealogical groups that also contain VSO languages, such as Berber, Semitic, and various subgroups of Austronesian.
Locus of Marking in Possessive Noun Phrases,,, Locus is a convenient one-word term for what is also known as head/dependent marking. In any kind of phrase, overt morphosyntactic marking reflecting the syntactic relations within the phrase may be located on the head of the phrase, on a non-head (i.e. on a dependent), on both, or on neither. Examples illustrating marking of various kinds in possessive noun phrases are (1)-(4) below. In possessive phrases, the possessed noun is head and the possessor is dependent.
Order of Degree Word and Adjective,,, This map shows the position of degree words with respect to the adjective that they modify. For the purposes of this map, the term adjective  should be interpreted in a purely semantic sense, as a word denoting a property, since in many languages the words in question do not form a separate word class, but are verbs or nouns. Degree words are words with meanings like ‘very’, ‘more’, or ‘a little’ that modify the adjective to indicate the degree to which the property denoted by the adjective obtains. Degree words are traditionally referred to as adverbs, though in many languages the degree words do not belong to the same word class as adverbs; even for English there is little basis for saying that degree words belong to the same word class as adverbs which modify verbs.
Inclusive/Exclusive Distinction in Independent Pronouns,,, The distinction between an inclusive and an exclusive pronoun is a commonly attested feature of linguistic structure, yet from a Eurocentric point of view this distinction is particularly exotic. For speakers of English (or any other European language), both the inclusive and the exclusive pronouns are to be translated as we. The difference between the two depends on the intended meaning. An inclusive pronoun necessarily includes reference to the addressee. For example, the Mandarin inclusive pronoun zámen means ‘we, I and you’; others can optionally be included. An exclusive pronoun, like the Mandarin pronoun wŏmen, excludes the addressee from the reference, resulting in a meaning like ‘I and some others, but not you’.
Inclusive/Exclusive Forms in Pama-Nyungan,,, The Pama-Nyungan stock covers Australia almost completely. Only in northern Australia are there languages which are not part of this stock, commonly called non-Pama-Nyungan (these languages are not included in this map). The Pama-Nyungan languages originally did not have an inclusive/exclusive opposition, although currently many Pama-Nyungan languages have developed it (Dixon 1980: 334-336). 
Distance Contrasts in Demonstratives,,, Demonstratives are deictic expressions such as English this and that. They indicate the relative distance of a referent in the speech situation vis-à-vis the deictic center. The deictic center, which is also called the origo, is roughly equivalent to the speaker’s location at the time of the utterance. When this and that are used contrastively, this denotes a referent in relative proximity to the deictic center and that denotes a referent at a greater distance:
Inclusive/Exclusive Distinction in Verbal Inflection,,, The distinction between an inclusive and an exclusive pronoun is a commonly attested feature of linguistic structure, yet from a Eurocentric point of view this distinction is particularly exotic. For speakers of English (or any other European language), both the inclusive and the exclusive pronouns are to be translated as we. The difference between the two depends on the intended meaning. An inclusive pronoun necessarily includes reference to the addressee. For example, the Mandarin inclusive pronoun zámen  means ‘we, I and you’; others can optionally be included. An exclusive pronoun, like the Mandarin pronoun wŏmen, excludes the addressee from the reference, resulting in a meaning like ‘I and some others, but not you’.
Order of Demonstrative and Noun,,, This map shows the different orders of demonstrative and noun. For the purposes of this map, a word or affix is considered a demonstrative if it satisfies at least one of two criteria: (1) it has among its uses a meaning that contrasts with some other form in terms of physical proximity to the speaker, so that there is at least a two-way contrast of proximal (near speaker) versus distal (not near speaker); or (2) the form has among its uses an indication that the hearer is intended to direct their attention towards something in the physical environment. In many and probably most languages, demonstratives are associated with both of these functions. The words this  and that  (and their plural forms these  and those ) constitute the demonstratives of English. In many languages, including English, the demonstratives can be used without a difference in form, either as modifiers of nouns, as in (1a), or pronominally (not modifying a noun), as in (1b).
Uvular Consonants,,, This chapter will discuss the distribution of one of the less common types of consonants, those with a uvular place of articulation. Consonants of this class are not as rare as those discussed in Chapter 19, but are nonetheless found in only roughly one sixth of the language surveyed. Most languages have consonants in which the back of the tongue is raised toward the velum; some also have consonants in which the back of the tongue is raised toward the point where the opening into the nasal cavity is located. These are called uvular consonants.
Negative Morphemes,,, This map shows the nature of morphemes signalling clausal negation in declarative sentences. By clausal negation is meant the simple negation of an entire clause; (1b) is the negative clause corresponding to the affirmative clause in (1a)
Relativization on Obliques,,, We distinguish five major groups of languages here. First, there are a number of languages that relativize upon obliques by employing the relative pronoun strategy, as exemplified in the Russian sentence in (1).
'When' Clauses,,, As was done for purpose clauses (Chapter 125), ‘when’ clauses are defined in functional, rather than morphosyntactic, terms. A ‘when’ construction is regarded as one encoding a temporal relation between two events, such that there is a temporal overlap between the two. The exact extent of the overlap is unspecified and subject to variation. For instance, in (1) and (2) the linked events are simultaneous, while in (3) they may or may not be simultaneous – in fact, there might be an interval of some days, or even months or years between them. The theoretical implications of this definition are discussed in Cristofaro (2003: ch. 2, 6), where a number of pragmatic criteria are provided to identify ‘when’ clauses under this definition.
Action Nominal Constructions,,, Map 62A shows the distribution across the world’s languages of constructions corresponding to the English John’s running and the enemy’s destruction of the city. These are action nominal constructions (ANCs), i.e. constructions which have an action nominal (AN, running, destruction) as their head and contain a reference to the participants in the situation designated by that AN. ANs themselves are either nouns or at least occur in typical nominal positions and show inflectional properties and/or combinability with adpositions typical of nouns. They are, however, in some reasonably productive way derived from verbs, either derivationally or inflectionally, and refer to events and/or facts, i.e. not just to actions, as the name might imply.  The issue at stake is whether words like running and destruction exist in a language at all and if so, how they combine with their arguments – such as John  (the S argument), the enemy  (the A argument) and the city  (the P argument). (See also Chapter 102 for the notions S, A and P.)
The Position of Negative Morphemes in Object-Initial Languages,,, Nothing found on this topic!
NegSOV Order,,, Nothing found on this topic!
SVNegO Order,,, Nothing found on this topic!
Obligatory Double Negation in SOV languages,,, Nothing found on this topic!
SOVNeg Order,,, Nothing found on this topic!
Verb-Initial with Clause-Final Negative,,, Nothing found on this topic!
Position of Negative Word With Respect to Subject, Object, and Verb,,, Nothing found on this topic!
Verb-Initial with Preverbal Negative,,, Nothing found on this topic!
SNegVO Order,,, Nothing found on this topic!
SONegV Order,,, Nothing found on this topic!
Multiple Negative Constructions in SOV Languages,,, Nothing found on this topic!
Double negation in verb-initial languages,,, Nothing found on this topic!
Optional Double Negation in SVO languages,,, Nothing found on this topic!
SVONeg Order,,, Nothing found on this topic!
Position of negative words relative to beginning and end of clause and with respect to adjacency to verb,,, Nothing found on this topic!
