Feature_Name,,, Feature_Definition
Position of Polar Question Particles,,, This map shows the position of question particles in polar questions. Polar questions are ones that elicit the equivalent of a ‘yes’ or ‘no’ response. This map does not include interrogative affixes on verbs, although it should be noted that the distinction between interrogative affixes and separate interrogative particles is often hard to make. The map treats interrogative clitics that can attach to words of different categories as question particles. Map 116A shows the distribution of different ways to signal polar questions, including question particles, but does not show their position in the sentence. A number of languages shown on Map 116A as having question particles are not shown on this map because their position is not clear from available materials.
Order of Person Markers on the Verb,,, Map 104A represents the order of A and P person markers on the verb relative to each other, where A stands for the person marker of the agentive argument of a transitive verb and P for the person marker of the patient argument of the transitive verb. Five values are represented:
Sex-based and Non-sex-based Gender Systems,,, We saw in Chapter 30 how, in many languages, nouns may be divided into groups according to the agreements they take, even when we control for other factors such as number and case. We should then ask whether these groups are arbitrary. The answer is that there is always a semantic “core” to the system. That is, there is an overlap between the nouns which take a particular set of agreements and some semantic feature. (This overlap may be greater or smaller, as we shall see in Chapter 32.) In the familiar systems such as French and German, and indeed in the majority, the link is to biological sex. This was illustrated from Russian, in Chapter 30, and can be seen again in Bininj Gun-Wok (Gunwinygic; northern Australia; Evans et al. 2002: table 1). Here we see agreement of the adjective in gender in the Kunwinjku dialect of the language (older speakers):
Nonperiphrastic Causative Constructions,,, The causative construction is a linguistic expression which denotes a complex situation consisting of two component events (Comrie 1989: 165-166; Song 2001: 256-259): (i) the causing event, in which the causer does or initiates something; and (ii) the caused event, in which the causee carries out an action, or undergoes a change of condition or state as a result of the causer’s action. The following Japanese sentence is such a linguistic expression.
Absence of Common Consonants,,, In the chapter on the size of consonant inventories (Chapter 1) the kinds of sounds that are most often found in the consonant inventories of the world’s languages were briefly discussed. In this chapter the focus is on the absence of some of the classes of sounds which typically occur in the world’s languages, and on where these absences occur. Absences of three classes of consonant sounds — bilabials, fricatives, and nasals — which occur in the vast majority of languages will be discussed. Each of these terms will be defined before discussion of the geographical distribution of the pattern. Absence of a fourth class of common consonants, laterals, is discussed in Chapter 8.
Intensifiers and Reflexive Pronouns,,, Reflexive pronouns (or “reflexive anaphors“) are expressions which are prototypically used to indicate that a non-subject argument of a transitive predicate is coreferential with (or bound by) the subject, i.e. expressions like German sich, Russian sebja, Turkish kendi, Mandarin zìjĭ, English x-self:
The Perfect,,, By perfect we mean a category with approximately the same semantics as the English (Present) Perfect in I have read this book, which is used to express events that took place before the temporal reference point but which have an effect on or are in some way still relevant at that point. This includes at least two related but distinguishable uses:
Finger and Hand,,, The main map of this chapter shows the distribution of the two primary ways in which languages lexically treat the human finger and the hand of which it is a constituent. 'Finger' refers to any one of the hand’s five appendages. ('Fingers' is a collection of two or more of the latter.) 'Hand' is defined as that part of the upper limb from the fingertips to the wrist. Two values are represented:
Verbal Person Marking,,, Map 102A depicts the number and identity of the arguments of a transitive clause which display person marking on the verb. “A” stands for the agentive argument and “P” for the patient argument. Five feature values are represented:
Weight-Sensitive Stress,,, In this chapter we focus on systems in which the placement of stress is sensitive to properties of syllables. In general, if a stress system is sensitive to such properties, this means that syllables fall into two classes, called heavy and light syllables. The former are such that they “attract stress”, while the latter only get stress if they happen to be in the right location in the string of syllables. In some languages, syllable weight has been argued to form a scale with more than two values.
'Want' Complement Subjects,,, This chapter looks at one important aspect of the syntax of 'want': whether the notional subject of its complement predication is left implicit when it is coreferential with the wanter, or whether it is expressed overtly in the complement clause by means of a pronominal element.
Order of Relative Clause and Noun,,, Map 90A shows the order of relative clause and noun. A construction is considered a relative clause for the purposes of this map if it is a clause which, either alone or in combination with a noun, denotes something and if the thing denoted has a semantic role within the relative clause. If there is a noun inside or outside the relative clause that denotes the thing also denoted by the clause, that noun will be referred to as the head of the relative clause. Headless relative clauses (like English what I bought at the store ) are not relevant to this map.
Prenominal relative clauses,,, Maps 90B to 90G primarily expand on the last feature value shown on Map 90A, those languages which lack a single dominant type of relative clause but where there are two types of relative clauses with neither dominant. To show the combination of these two types of relative clauses, each of the six maps corresponds to one of the first six types on Map 90A. For comparison the first feature value on each map shows languages in which that type is the dominant type and is therefore identical to the corresponding feature value on Map 90A.
Postnominal relative clauses,,, Nothing found on this topic!
Double-headed relative clauses,,, Nothing found on this topic!
Correlative relative clauses,,, Nothing found on this topic!
Internally-headed relative clauses,,, Nothing found on this topic!
Adjoined relative clauses,,, Nothing found on this topic!
Order of Adverbial Subordinator and Clause,,, This map shows the position of adverbial subordinators, morphemes which mark adverbial clauses for their semantic relationship to the main clause. Adverbial subordinators which are separate words are referred to as subordinating conjunctions  by traditional grammar. Examples of adverbial subordinators in English include because, although, when, while, and if. The map further distinguishes adverbial subordinators which are separate words from ones which are affixes on verbs.
Predicative Adjectives,,, This map shows the distribution of the various options in the encoding of predicative adjectives, i.e. items which predicate a property of a subject. The basic distinction is between those languages in which predicative adjectives are encoded in a way that is parallel to predicative verbs, and those languages in which the encoding of predicative adjectives and verbs is different. An example of this latter, nonverbal, encoding of predicative adjectives is English. As shown in the sentences in (1), English shows third person agreement in the present tense of its predicative verbs, but this option is not available for predicative adjectives: *John tall-s is not acceptable in the language. On the other hand, Bororo (Macro-Gê; Mato Grosso, Brazil) offers an instance of verbal encoding of predicative adjectives; as the sentences in (2) demonstrate, the encoding of predicative verbs and of predicative “property words” is identical.
Prefixing vs. Suffixing in Inflectional Morphology,,, Languages were assigned a prefixing index and a suffixing index in the following way. For each affix type above for which the language predominantly employs prefixes, one point was assigned to the prefixing index for the language, and analogously for the suffixing index. If for a given affix type, a language has both prefixes and suffixes with neither deemed dominant, half a point was added to both the prefixing index and the suffixing index of the language. However, the first three affix types in the above list were considered sufficiently important that they were assigned twice as many points as the other affix types: for each of these affix types, if a language predominantly employs prefixes, two points were added to the prefixing index of the language and analogously for suffixes. If for one of these three types, a language has both prefixes and suffixes with neither deemed dominant, one point was added to both the prefixing index and the suffixing index of the language. In the discussion below, I will refer to the sum of the prefixing index and the suffixing index as the affixing index. Note that the number of distinct morphemes of a given type was not considered: for example, a language with a single tense-aspect suffix was coded the same as a language with many tense-aspect suffixes. Derivational affixes and other types of inflectional affixes were not considered.
Epistemic Possibility,,, The map gives some indication of the strategies used to express epistemic possibility in positive main clauses. Three types of languages are distinguished. The definitions refer to three types of marking: verbal constructions, affixes on verbs, and other constructions, ordered in terms of increasing cross-linguistic frequency. Languages of the first type use the least frequent markers, whether or not they also use the more frequent ones. Languages of the second type use the medium frequency markers, whether or not they also use the most frequent ones. Languages of the third type only use the most frequent markers.
Order of Genitive and Noun,,, This map shows the order of a genitive or possessor noun phrase with respect to the head noun. In the example in (1) from Finnish, tytön  ‘the girl’s’ is the genitive noun phrase, while kissa  ‘cat’ is the head noun, so the order in Finnish is GenN (genitive preceding head noun).
Polar Questions,,, This map shows the method a language uses to indicate that an utterance is a polar question. Polar questions are ones to which the expected answer is the equivalent of ‘yes’ or ‘no’ (and which are thus sometimes called yes-no questions ). They contrast with content questions, which contain an interrogative word meaning something like ‘who’ or ‘where’, in which some more specific answer is expected; content questions in English are often called wh-questions. 
Person Marking on Adpositions,,, This map gives a survey of the distribution of languages with person markers on their adpositions. An example of a person-marked preposition is found in (1) from Maybrat (West Papuan; Papua, Indonesia).
Symmetric and Asymmetric Standard Negation,,, Standard negation can be defined as the basic way (or ways) a language has for negating declarative verbal main clauses. Negative constructions that fall outside standard negation include the negation of existential, copular or non-verbal clauses, the negation of subordinate clauses, and the negation of non-declarative clauses like imperatives (see Chapter 71). These negatives are not taken into account here, but it is of course possible that languages use their standard negation constructions for the negation of these clause types too.This map shows how symmetric and asymmetric standard negation are distributed among the languages of the world. In symmetric negation the structure of the negative is identical to the structure of the affirmative, except for the presence of the negative marker(s). In asymmetric negation the structure of the negative differs from the structure of the affirmative in various other ways too, i.e. there is asymmetry between affirmation and negation. Affirmative and negative structures can be symmetric or asymmetric in two ways: there can be (a)symmetry either between the affirmative and negative constructions, or between the paradigms that the affirmative and negative constructions form. Symmetric negative constructions do not differ from the corresponding affirmative constructions in any other way than by the presence of the negative marker(s), whereas asymmetric negative constructions show structural differences in comparison to the corresponding affirmative constructions. In symmetric paradigms, all (verbal) categories or forms have corresponding affirmative and negative forms, whereas in asymmetric paradigms such one-to-one correspondences do not obtain.
Order of Adposition and Noun Phrase,,, This map shows the order of adposition and noun phrase.  The two primary types of adpositions are prepositions and postpositions: prepositions precede the noun phrase they occur with, as in English and in the Boumaa Fijian (Austronesian) example in (1a), while postpositions follow the noun phrase they occur with, as in the Lezgian (Nakh-Daghestanian; Russia) example in (1b).
Para-Linguistic Usages of Clicks,,, Clicks are acoustically salient speech sounds formed by the sudden opening of a closure resulting in a sharp inflow of air towards a secondary occlusion at the back of the mouth. As phonemes, the basic building blocks of words, clicks are very limited in their geographic distribution. Phonemic clicks occur only in southern Africa, plus a little pocket further to the northeast, in Tanzania; elsewhere in the world, they are absent. The limited distribution of phonemic clicks is displayed in Map 19A.However, click sounds are actually very common throughout the world, in a variety of usages which might be termed para-linguistic. A familiar example is the English sound which, when repeated, is spelled either as tut tut  or as tsk tsk.The para-linguistic nature of such clicks is reflected in a number of exceptional features. Phonetically, they involve sounds lying outside ordinary phonemic inventories. Grammatically, they are not integrated into morphological and syntactic structures. And semantically, they convey a very restricted range of meanings, some of which are associated with the expression of emotions.
Reduplication,,, The repetition of phonological material within a word for semantic or grammatical purposes is known as reduplication, a widely used morphological device in a number of the world’s languages. The languages classified on the accompanying map are sorted into three categories: languages that do not employ reduplication as a grammatical device, languages that productively employ both partial and full reduplication, and languages that only employ full reduplication.Full reduplication is the repetition of an entire word, word stem (root with one or more affixes), or root. Examples are Nez Perce (Sahaptian; northwestern United States) full word lexical reduplication: té:mul  ‘hail’ vs. temulté:mul  ‘sleet’ (Aoki 1963: 43), or Tagalog full root reduplication, shown here with the verbalizing prefix mag-, where the reduplicant isip  is identical to the base isip  ‘think’: mag-isip  ‘to think’ vs. mag-isip-isip  ‘to think about seriously.’
Fusion of Selected Inflectional Formatives,,, Since its beginning in the 19th century, morphological typology has postulated a universal scale of less vs. more tightly packed word forms. The scale ranges from isolating to agglutinative to fusional to introflexive, and is canonically exemplified by Chinese (isolating), Turkish (agglutinative), Latin (fusional) and Modern Standard Arabic (introflexive). Recent research has shown that such a scale conflates many different typological variables and incorrectly assumes that these parameters covary universally (see Plank 1999, Bickel and Nichols 2005, among others). Three prominent variables involved in this are phonological fusion, formative exponence, and flexivity (i.e. allomorphy, inflectional classes). In this chapter we concentrate on fusion. For exponence, see Chapter 21, and for one aspect of flexivity, see Chapter 59 (on possessive classification).
Number of Genders,,, In some languages gender is evident in almost every phrase, while in other languages it is absent. This contrast raises interesting questions as to its function. Equally, in some languages it is relatively easy to determine the type of gender system and to establish how many genders the language has, while in others it takes careful analysis. 
Occurrence of Nominal Plurality,,, This map shows the extent to which plural markers on full nouns are used in a language (full nouns are nouns which are not pronouns; see Chapter 35 for the plural of personal pronouns). Plural markers can have different formal manifestations (see Chapter 33), which play no role in this chapter. Here we look only at the occurrence of plural markers, which varies along at least two dimensions: animacy and obligatoriness. In the animacy dimension, the most important contrast is between animate (especially human) nouns and inanimate nouns, which are treated differently in many languages (see §2.1 for animal nouns, which are neither human nor inanimate). In the obligatoriness dimension, I distinguish here between non-occurrence, optional occurrence and obligatory occurrence. When these two dimensions are combined, we get the six values shown in the feature-value box.
Syncretism in Verbal Person/Number Marking,,, This map records instances of syncretism in the inflectional marking of subject person in verbs. For example, in German, the same form is regularly used for both 1st and 3rd person subjects in the plural, e.g. machen  ‘(we/they) make’ or machten  ‘(we/they) made’. 
Relationship between the Order of Object and Verb and the Order of Relative Clause and Noun,,, This is the second of three maps that show the relationship between two features that are shown separately in earlier maps, namely the order of relative clause and noun (Map 90A) and the order of object and verb (Map 83A). The two orders of object and verb and the two orders of relative clause and noun intersect to define the first four values shown in the value table.
Negative Indefinite Pronouns and Predicate Negation,,, Negative indefinite pronouns like 'nobody', 'nothing', 'nowhere' may or may not co-occur with the ordinary marker of predicate negation. A language where they always co-occur with predicate negation is Russian. In (1a-b), omission of the predicate negator ne  would render the sentences ungrammatical.
Writing Systems,,, This map is concerned with the linguistic structure of different writing systems, in particular the unit of linguistic structure that is represented most directly in the writing system in question. Five basic systems can be represented, as given in 1–5 in the feature box; mixed systems are also possible, although only one, number 6 in the feature box, is included in the Map 141A.
N-M Pronouns,,, Personal pronouns, like other closed-class forms, tend to contain nasals and other basic consonants.  However, particular paradigmatic combinations of consonants in particular person-number categories are not especially frequent worldwide. There are only two such combinations that show up interestingly on a map: pronoun sets like English me  and thee  or Nanai (Tungusic; eastern Siberia) mi  'I, me' and si  'you', with m  in the first person and a coronal obstruent in the second, which are common in northern Eurasia and rare elsewhere; and sets like Northeast Maidu (Penutian; California) ni  'I, me' and mi  'you' with n  in the first person and m  in the second, which are common in western America and rare elsewhere. Map 136A here shows the first type, henceforth "m-T"  patterns, and Map 137A the second, henceforth "n-m"  patterns.The maps here are based on the first and second person singular forms only. They survey the first consonant in the pronoun root, whether it is word-initial as in Wintu (Penutian; California) ni  'I, me; we, us' or follows an initial vowel as in Nez Perce (Sahaptian; Idaho and Oregon) 'iin  'I, me'. (Whether written or not, the glottal stop that precedes an initial vowel is not considered the first consonant. The Nez Perce form just cited begins with such a glottal stop.) They survey three pronominal forms: independent pronoun words like English I, me, you; possessive affixes as in Hungarian ház-am  'my house', ház-ad  'your house'; and verbal affixes as in Rama (Chibchan; Nicaragua) n-taak-i  'I am going', m-taak-i  'you are going' (Grinevald 1988). (Of course, not all languages have all three series.) They consider the two most widely distributed allomorphs of each, e.g. English I  and me  for first person singular.
M in Second Person Singular,,, Nothing found on this topic!
Green and Blue,,, In recent models of the universals and evolution theory of basic colour terms, stemming originally from Berlin and Kay (1969), three kinds of universal colour categories are recognized (Kay and McDaniel 1978, Kay et al. 1991, Kay et al. 1997, Kay and Maffi 1999): primary colour categories, composite (disjunctive) colour categories, and derived (intersective) colour categories.First, there are the six primary colours recognized in the widely accepted theory of colour opponency (Hering 1964 [1920], Jameson and Hurvich 1968; Hurvich 1982):BlackWhiteRedYellowGreenBlueThese are the two pairs of fundamental opponent chromatic colours <Red, Green> and <Yellow, Blue> and the single pair of fundamental achromatic colours <Black, White>. Black and white are not opposed in the same sense as the chromatic pairs. For example, we can see a combination of black and white (gray) but there is no sensation consisting of the combination of red and green or of blue and yellow. (That blue and yellow pigments can be mixed to produce a green pigment is not relevant; there are no bluish yellow or yellowish blue sensations.)
Alignment of Verbal Person Marking,,, Languages differ not only in regard to the number and nature of the arguments displaying verbal person marking (see Chapter 102), but also in the alignment of the person markers. The term alignment may be intuitively understood as reflecting how the two arguments of the transitive verb, the agentive argument (A) and the more patient-like argument (P), align with the sole argument of the intransitive verb, the S. In Map 100A the alignments of verbal person markers are represented by the following six values:
Exponence of Selected Inflectional Formatives,,, Exponence refers to the number of categories that cumulate into a single formative. The universal default is to express each category by a dedicated formative. These are monoexponential (or separative) formatives. Polyexponential (or cumulative) formatives, i.e. formatives which simultaneously code more than one category, are much rarer. A well-known example is number and case in many Indo-European languages. Marking of case in these languages involves the same formative as marking of number, and it is impossible to identify separate markers of case and number. Thus, in Russian, genitive singular is -i or -a and genitive plural -ej or -ov or -ø, and there is no element in these forms that exclusively expresses case or number. When categories are not cumulated into a single formative, each has its own separate marker. This is so in Turkish, where number is always expressed on nouns by means of the suffix -ler and for each case there is a separate suffix that can combine with -ler, e.g. genitive -in (plural -ler-in), accusative -i (plural -ler-i ), dative -e (plural -ler-e), etc.Exponence is a purely morphological notion; in particular it is independent of the phonological connection between host and formative. Therefore, monoexponential formatives can combine with any fusion type (see Chapter 20 for the definition of fusion types). Thus, the Fijian past tense formative aa (see example (1) in Chapter 20) is monoexponential and isolating. The Turkish past tense formative -ti (and its alternants) is monoexponential and concatenative. The Kisi high tone past perfective formative is monoexponential and nonlinear.
Exponence of Tense-Aspect-Mood Inflection,,, Nothing found on this topic!
